{
  "applicable_platform": {
    "observed_context": "Audit documents associate this checkout with the Ubuntu 20.04, ROS 2 Foxy and aarch64 workspace; applicability is not confirmed.",
    "status": "unverified",
    "value": null
  },
  "baseline_status": "unverified",
  "business_purpose": {
    "observed_context": "The current differences are preserved observations. Their business necessity has not been confirmed by a maintainer.",
    "status": "unverified",
    "value": null
  },
  "checkout": {
    "branch": "foxy",
    "state": "branch"
  },
  "classifications": {
    "configuration_modification": 0,
    "deletion": 13,
    "mode_change": 0,
    "mode_only": 0,
    "source_modification": 0,
    "untracked": 0
  },
  "content": {
    "algorithm": "workspace-content-manifest-sha256-v1",
    "entry_count": 5,
    "sha256": "02628c66a0c0ce8bde702c620717c13df732277b2a43f3bab36a36dcc736ec66"
  },
  "file_mode_differences": {
    "count": 0,
    "entries": []
  },
  "maintainer_confirmation": {
    "confirmed_at": null,
    "notes": "No maintainer confirmation was present at capture time.",
    "reviewer": null,
    "status": "unapproved"
  },
  "observed_at": "2026-07-26T17:42:00+08:00",
  "patch": {
    "artifact_path": "docs/evidence/receipts/patches/navigation_msgs.patch.b64",
    "artifact_sha256": "58ca2e3df8cb515d3a8f1186004be3625a2dad457aa348bb6a9f3a728e02fc88",
    "format": "git-diff-binary-v1+base64",
    "includes": [
      "tracked_diff",
      "staged_diff",
      "untracked_files"
    ],
    "sha256": "a39a4cf8bae05b484eb529c8ab793e7c1900881685f6dee0029b18805537db25"
  },
  "receipt_id": "workspace-receipt-navigation_msgs",
  "replay_order": [
    "verify_origin_and_head",
    "apply_patch_artifact",
    "verify_content_manifest_sha256",
    "obtain_maintainer_confirmation"
  ],
  "repository": {
    "base_sha": "fe880e99d993e9d4dfbf37f00d839d32994610e1",
    "head": "fe880e99d993e9d4dfbf37f00d839d32994610e1",
    "lock_manifest": "workspace.lock.repos",
    "origin": "https://github.com/ros-planning/navigation_msgs.git",
    "path": "src/navigation_msgs"
  },
  "schema_version": "1.0.0",
  "staged_diff": {
    "changed_file_count": 0,
    "entries": [],
    "patch_sha256": "e3b0c44298fc1c149afbf4c8996fb92427ae41e4649b934ca495991b7852b855"
  },
  "tracked_diff": {
    "changed_file_count": 13,
    "entries": [
      {
        "categories": [
          "deletion"
        ],
        "git_status": "D",
        "new_mode": null,
        "old_mode": "100644",
        "path": "map_msgs/CHANGELOG.rst"
      },
      {
        "categories": [
          "deletion"
        ],
        "git_status": "D",
        "new_mode": null,
        "old_mode": "100644",
        "path": "map_msgs/CMakeLists.txt"
      },
      {
        "categories": [
          "deletion"
        ],
        "git_status": "D",
        "new_mode": null,
        "old_mode": "100644",
        "path": "map_msgs/msg/OccupancyGridUpdate.msg"
      },
      {
        "categories": [
          "deletion"
        ],
        "git_status": "D",
        "new_mode": null,
        "old_mode": "100644",
        "path": "map_msgs/msg/PointCloud2Update.msg"
      },
      {
        "categories": [
          "deletion"
        ],
        "git_status": "D",
        "new_mode": null,
        "old_mode": "100644",
        "path": "map_msgs/msg/ProjectedMap.msg"
      },
      {
        "categories": [
          "deletion"
        ],
        "git_status": "D",
        "new_mode": null,
        "old_mode": "100644",
        "path": "map_msgs/msg/ProjectedMapInfo.msg"
      },
      {
        "categories": [
          "deletion"
        ],
        "git_status": "D",
        "new_mode": null,
        "old_mode": "100644",
        "path": "map_msgs/package.xml"
      },
      {
        "categories": [
          "deletion"
        ],
        "git_status": "D",
        "new_mode": null,
        "old_mode": "100644",
        "path": "map_msgs/srv/GetMapROI.srv"
      },
      {
        "categories": [
          "deletion"
        ],
        "git_status": "D",
        "new_mode": null,
        "old_mode": "100644",
        "path": "map_msgs/srv/GetPointMap.srv"
      },
      {
        "categories": [
          "deletion"
        ],
        "git_status": "D",
        "new_mode": null,
        "old_mode": "100644",
        "path": "map_msgs/srv/GetPointMapROI.srv"
      },
      {
        "categories": [
          "deletion"
        ],
        "git_status": "D",
        "new_mode": null,
        "old_mode": "100644",
        "path": "map_msgs/srv/ProjectedMapsInfo.srv"
      },
      {
        "categories": [
          "deletion"
        ],
        "git_status": "D",
        "new_mode": null,
        "old_mode": "100644",
        "path": "map_msgs/srv/SaveMap.srv"
      },
      {
        "categories": [
          "deletion"
        ],
        "git_status": "D",
        "new_mode": null,
        "old_mode": "100644",
        "path": "map_msgs/srv/SetMapProjections.srv"
      }
    ],
    "patch_sha256": "a39a4cf8bae05b484eb529c8ab793e7c1900881685f6dee0029b18805537db25"
  },
  "untracked_files": []
}
